{
  "schema": "rhythm-soundcheck/statement/v1",
  "tool": "rhythm-soundcheck",
  "version": "1.3.0",
  "date": "2026-10-26",
  "layout": "service",
  "wcag": "2.1",
  "en301549": "V3.2.1",
  "standard": "WCAG 2.1 level AA / EN 301 549 V3.2.1",
  "status": null,
  "evidence_note": "Automated and keyboard tests find some accessibility problems, not all. This is evidence for your own review, not a statement that the site meets WCAG, EN 301 549 or the European Accessibility Act.",
  "todo": 13,
  "website": "https://shop.example",
  "owner": {
    "name": "\u003cimg src=x onerror=alert(1)\u003e Café 咖啡",
    "email": "access@shop.example",
    "phone": "+1 \u003cb\u003e555\u003c/b\u003e",
    "address": "| a | b |",
    "enforcement": "# heading - list txet",
    "scope": []
  },
  "pages": 4,
  "private_pages": 0,
  "checked": [
    "/\"\u003e\u003cscript\u003ealert(1)\u003c/script\u003e",
    "/[x](javascript:alert(1))/**b**/`c`/\u0026",
    "/a|b|c/gnp.exe",
    "/商品/コーヒー/"
  ],
  "axe": "4.14.0",
  "axe_rules": 2,
  "totals": {
    "criteria": 50,
    "failed": 1,
    "not_tested": 23
  },
  "criteria": [
    {
      "id": "1.1.1",
      "title": "Non-text Content",
      "level": "A",
      "principle": "Perceivable",
      "en301549": "9.1.1.1",
      "coverage": "partly",
      "tested_by": [
        "axe:aria-meter-name",
        "axe:aria-progressbar-name",
        "axe:image-alt",
        "axe:input-image-alt",
        "axe:object-alt",
        "axe:role-img-alt",
        "axe:svg-img-alt"
      ],
      "how_tested": "partly: axe aria-meter-name, aria-progressbar-name, image-alt, input-image-alt, object-alt, role-img-alt, svg-img-alt",
      "result": "failures_found",
      "tests": "failures_found",
      "text": "failures found (1 element, 3 pages)",
      "issues": 1,
      "pages": 3,
      "paths": [
        "/\"\u003e\u003cscript\u003ealert(1)\u003c/script\u003e",
        "/a|b|c/gnp.exe",
        "/商品/コーヒー/"
      ],
      "manual": null
    },
    {
      "id": "1.2.1",
      "title": "Audio-only and Video-only (Prerecorded)",
      "level": "A",
      "principle": "Perceivable",
      "en301549": "9.1.2.1",
      "coverage": "partly",
      "tested_by": [
        "axe:audio-caption"
      ],
      "how_tested": "partly: axe audio-caption",
      "result": "no_failures_found",
      "tests": "no_failures_found",
      "text": "no failures found by these tests",
      "issues": 0,
      "pages": 0,
      "paths": [],
      "manual": null
    },
    {
      "id": "1.2.2",
      "title": "Captions (Prerecorded)",
      "level": "A",
      "principle": "Perceivable",
      "en301549": "9.1.2.2",
      "coverage": "partly",
      "tested_by": [
        "axe:video-caption"
      ],
      "how_tested": "partly: axe video-caption",
      "result": "no_failures_found",
      "tests": "no_failures_found",
      "text": "no failures found by these tests",
      "issues": 0,
      "pages": 0,
      "paths": [],
      "manual": null
    },
    {
      "id": "1.2.3",
      "title": "Audio Description or Media Alternative (Prerecorded)",
      "level": "A",
      "principle": "Perceivable",
      "en301549": "9.1.2.3",
      "coverage": "none",
      "tested_by": [],
      "how_tested": "not tested: needs a person",
      "result": "not_tested",
      "tests": "not_tested",
      "text": "not tested: needs a person",
      "issues": 0,
      "pages": 0,
      "paths": [],
      "manual": null
    },
    {
      "id": "1.2.4",
      "title": "Captions (Live)",
      "level": "AA",
      "principle": "Perceivable",
      "en301549": "9.1.2.4",
      "coverage": "none",
      "tested_by": [],
      "how_tested": "not tested: needs a person",
      "result": "not_tested",
      "tests": "not_tested",
      "text": "not tested: needs a person",
      "issues": 0,
      "pages": 0,
      "paths": [],
      "manual": null
    },
    {
      "id": "1.2.5",
      "title": "Audio Description (Prerecorded)",
      "level": "AA",
      "principle": "Perceivable",
      "en301549": "9.1.2.5",
      "coverage": "none",
      "tested_by": [],
      "how_tested": "not tested: needs a person",
      "result": "not_tested",
      "tests": "not_tested",
      "text": "not tested: needs a person",
      "issues": 0,
      "pages": 0,
      "paths": [],
      "manual": null
    },
    {
      "id": "1.3.1",
      "title": "Info and Relationships",
      "level": "A",
      "principle": "Perceivable",
      "en301549": "9.1.3.1",
      "coverage": "partly",
      "tested_by": [
        "axe:aria-hidden-body",
        "axe:aria-required-children",
        "axe:aria-required-parent",
        "axe:definition-list",
        "axe:dlitem",
        "axe:list",
        "axe:listitem",
        "axe:td-headers-attr",
        "axe:th-has-data-cells"
      ],
      "how_tested": "partly: axe aria-hidden-body, aria-required-children, aria-required-parent, definition-list, dlitem, list, listitem, td-headers-attr, th-has-data-cells",
      "result": "no_failures_found",
      "tests": "no_failures_found",
      "text": "no failures found by these tests",
      "issues": 0,
      "pages": 0,
      "paths": [],
      "manual": null
    },
    {
      "id": "1.3.2",
      "title": "Meaningful Sequence",
      "level": "A",
      "principle": "Perceivable",
      "en301549": "9.1.3.2",
      "coverage": "none",
      "tested_by": [],
      "how_tested": "not tested: needs a person",
      "result": "not_tested",
      "tests": "not_tested",
      "text": "not tested: needs a person",
      "issues": 0,
      "pages": 0,
      "paths": [],
      "manual": null
    },
    {
      "id": "1.3.3",
      "title": "Sensory Characteristics",
      "level": "A",
      "principle": "Perceivable",
      "en301549": "9.1.3.3",
      "coverage": "none",
      "tested_by": [],
      "how_tested": "not tested: needs a person",
      "result": "not_tested",
      "tests": "not_tested",
      "text": "not tested: needs a person",
      "issues": 0,
      "pages": 0,
      "paths": [],
      "manual": null
    },
    {
      "id": "1.3.4",
      "title": "Orientation",
      "level": "AA",
      "principle": "Perceivable",
      "en301549": "9.1.3.4",
      "coverage": "none",
      "tested_by": [],
      "how_tested": "not tested: needs a person",
      "result": "not_tested",
      "tests": "not_tested",
      "text": "not tested: needs a person",
      "issues": 0,
      "pages": 0,
      "paths": [],
      "manual": null
    },
    {
      "id": "1.3.5",
      "title": "Identify Input Purpose",
      "level": "AA",
      "principle": "Perceivable",
      "en301549": "9.1.3.5",
      "coverage": "partly",
      "tested_by": [
        "axe:autocomplete-valid"
      ],
      "how_tested": "partly: axe autocomplete-valid",
      "result": "no_failures_found",
      "tests": "no_failures_found",
      "text": "no failures found by these tests",
      "issues": 0,
      "pages": 0,
      "paths": [],
      "manual": null
    },
    {
      "id": "1.4.1",
      "title": "Use of Color",
      "level": "A",
      "principle": "Perceivable",
      "en301549": "9.1.4.1",
      "coverage": "partly",
      "tested_by": [
        "axe:link-in-text-block"
      ],
      "how_tested": "partly: axe link-in-text-block",
      "result": "no_failures_found",
      "tests": "no_failures_found",
      "text": "no failures found by these tests",
      "issues": 0,
      "pages": 0,
      "paths": [],
      "manual": null
    },
    {
      "id": "1.4.2",
      "title": "Audio Control",
      "level": "A",
      "principle": "Perceivable",
      "en301549": "9.1.4.2",
      "coverage": "partly",
      "tested_by": [
        "axe:no-autoplay-audio"
      ],
      "how_tested": "partly: axe no-autoplay-audio",
      "result": "no_failures_found",
      "tests": "no_failures_found",
      "text": "no failures found by these tests",
      "issues": 0,
      "pages": 0,
      "paths": [],
      "manual": null
    },
    {
      "id": "1.4.3",
      "title": "Contrast (Minimum)",
      "level": "AA",
      "principle": "Perceivable",
      "en301549": "9.1.4.3",
      "coverage": "partly",
      "tested_by": [
        "axe:color-contrast"
      ],
      "how_tested": "partly: axe color-contrast",
      "result": "no_failures_found",
      "tests": "no_failures_found",
      "text": "no failures found by these tests",
      "issues": 0,
      "pages": 0,
      "paths": [],
      "manual": null
    },
    {
      "id": "1.4.4",
      "title": "Resize Text",
      "level": "AA",
      "principle": "Perceivable",
      "en301549": "9.1.4.4",
      "coverage": "partly",
      "tested_by": [
        "axe:meta-viewport"
      ],
      "how_tested": "partly: axe meta-viewport",
      "result": "no_failures_found",
      "tests": "no_failures_found",
      "text": "no failures found by these tests",
      "issues": 0,
      "pages": 0,
      "paths": [],
      "manual": null
    },
    {
      "id": "1.4.5",
      "title": "Images of Text",
      "level": "AA",
      "principle": "Perceivable",
      "en301549": "9.1.4.5",
      "coverage": "none",
      "tested_by": [],
      "how_tested": "not tested: needs a person",
      "result": "not_tested",
      "tests": "not_tested",
      "text": "not tested: needs a person",
      "issues": 0,
      "pages": 0,
      "paths": [],
      "manual": null
    },
    {
      "id": "1.4.10",
      "title": "Reflow",
      "level": "AA",
      "principle": "Perceivable",
      "en301549": "9.1.4.10",
      "coverage": "partly",
      "tested_by": [
        "a11y/reflow"
      ],
      "how_tested": "partly: a11y/reflow",
      "result": "no_failures_found",
      "tests": "no_failures_found",
      "text": "no failures found by these tests",
      "issues": 0,
      "pages": 0,
      "paths": [],
      "manual": null
    },
    {
      "id": "1.4.11",
      "title": "Non-text Contrast",
      "level": "AA",
      "principle": "Perceivable",